sentences,keywords,cluster_ID_kmeans
Saw American Sniper and its a great movie about a true hero I've seen people say negative things about CKyle all I can say is he's a HERO,"ckyle, true hero, hero, american sniper, negative things, people",2
tom_watson over Eddie Redmayne or Benedict Cumberbatch Even Bradley Cooper in American Sniper acted better,"sniper, bradley cooper, american, benedict cumberbatch",2
Man I just watched American Sniper that movie is so good It deserved all the hype and Chris Kyle was a hero,"chris kyle, movie, kyle, american sniper, hype, hero",0
Just watched american sniper i hope to be half the man chris kyle was ChrisKyleFrog,"chriskylefrog, man, american sniper",2
Watched American Sniper last night Yet again Clint Eastwood produces a masterpiece Ooooooooohaaaaa Bradley Cooper Chris Kyle true hero,"chris kyle, ooooooooohaaaaa bradley, last night, clint eastwood, hero",0
American Sniper pas a ser mi segunda pelcula blica favorita bendito Clint Eastwood,"eastwood, clint eastwood, clint",2
Wow All the awards for BradleyCooper and AmericanSniper What a film,"bradleycooper, film",2
Clint Eastwood's 'American Sniper'my kind of moviethough i hate the end,"moviethough, clint eastwood 's ', american sniper'my kind, american, end",2
AMERICAN SNIPER di Clint Eastwood con Bradley Cooper Sienna Miller Salah Salea Giorni feriali spettacoli ore ,"miller salah, bradley cooper, spettacoli, feriali, ore, clint eastwood",2
OMFG American Sniper was so good King Bradley SLAYED Bae,"slayed, bae, king bradley",2
AmericanSniper confermo la mia scarsa simpatia per BradleyCooper ma la storia di ChrisKyle merita di essere conosciuta Eastwood egregio,"simpatia, chriskyle merita, bradleycooper, la",2
American Sniper was a good movie but goddamn I didn't expect the ending Fucking Clint Eastwood,"fucking clint eastwood, eastwood, good movie",2
"Francotirador Sinopsis elenco ficha American Sniper SINOPSIS Del director Clint Eastwood llega ""American ","american sniper sinopsis, francotirador sinopsis elenco ficha american sniper sinopsis del director clint eastwood llega, american, clint eastwood, francotirador sinopsis",2
AmericanSniper spettacolare Cooper impeccabile Clint Eastwood garanzia,"cooper, clint eastwood",2
American Sniper is so good  Chris kyle,"chris kyle, kyle",0
American Sniper Opens Friday Jan 16 2015Navy SEAL Chris Kyle logs an incredible number of k ,"k, chris kyle, jan, incredible number, seal",0
On page 13 of 528 of American Sniper by Chris Kyle ,"chris kyle, kyle",0
American Sniper|Movies Download - About This Movie Navy SEAL sniper Chris Kyles pinpoint accuracy saves ,"accuracy, download-about, chris kyles",0
Bulked up Bradley fights insurgents and himself in Eastwood's impressive American Sniper Our new review here ,"bradley fights insurgents, american, review, american sniper, new review",2
mi  e piaciuto molto American Sniper Chris  stato un mito,"e piaciuto molto, chris, mito, stato, american",0
Clint Eastwood - American Sniper (2015 Usa - Cast Bradley Cooper Sienna Miller Jake McDorman Luke Grime ,"grime, luke, eastwood-american sniper, sienna miller, usa-cast, luke grime",2
Don't judge me times have change americansniper chriskyle navyseals igsg ,"navyseals, americansniper, chriskyle",1
American Sniper was the best movie I have seen in forever Needless to say It made me fa in love with Bradley Cooper all over again,"bradley cooper, best movie",2
I watched American Sniper last night Clint Eastwood is to the art of filmmaking what Ched Evans is to the art of seduction,"art, seduction, clint eastwood, ched evans",2
halfway through AmericanSniper and it is fuckin good and Bradley Cooper is so sexy ,"bradley cooper, americansniper",2
"""La passione di Giovanna d'Arco"" (La passion de Jeanne d'Arc di Carl Theodor Dreyer e ""American sniper"" di Clint Eastwood - Purezza e Fede","sniper, american, clint, american sniper, clint eastwood-purezza, e",2
IFILMDAVEDERE American sniper non il migliore del vecchio clint ma cmq ottimo cinema senza fronzoli mette in scena l' orrore della guerra,"l, mette, il migliore del vecchio clint ma cmq ottimo cinema senza fronzoli mette, fronzoli, orrore, scena",2
American Sniper = amazing Bradley Coopers best movie yet,"bradley coopers, movie, best movie",2
"Manca il racconto di un contesto sociale Chris Kyle non ha amici o se ce li ha non sono raccontati - Cinema Solo - ""American sniper""","sniper, li, chris kyle, sono, american, ha amici",0
AmericanSniper MEH troppo troppo patriottico Primo film di Clint Eastwood che non mi  piaciuto peccato grande opportunit sprecata,"americansniper meh troppo troppo patriottico primo film, sprecata, mi, clint eastwood che, clint eastwood, primo",1
"Identiche immagini di repertorio finali per ""American sniper"" di Eastwood ""Big Eyes"" di Burton ""Unbroken"" di Jolie - Cinema Fotocopiato","burton "" unbroken "" di jolie-cinema fotocopiato, eastwood, repertorio finali, big eyes, american, american sniper",2
RottenTomatoes Chk out my movie review on American Sniper BradleyCooper clinteastwood USNAVYSEALS honor oedwy ,"movie review, honor, american sniper bradleycooper, oedwy, usnavyseals",2
"Identico Flashback in chiesa con sermone del pastore in ""American sniper"" di Clint Eastwood e ""Unbroken"" di Angelina Jolie Cinema Fotocopia","clint eastwood e, unbroken "" di, chiesa con sermone del pastore, jolie cinema fotocopia, american, american sniper",2
"Riflettere sulle somiglianze di prodotti commerciali americani - ""American sniper"" di Eastwood ""Big Eyes"" di Burton e ""Unbroken"" di Jolie","burton, eastwood, big eyes, unbroken "" di",2
American Sniper was so good Chris Kyle is a true American Hero thankyou GodBless,"chris kyle, godbless, american hero, american sniper",0
Per commentare AmericanSniper pi che ClintEastwood serve l'hashtag FriedrichNietzsche,"friedrichnietzsche, clinteastwood, l'hashtag",2
Ieri sera sono andata al cinema a vedere AmericanSniper  stato emozionante  Prevedo una candidatura all'oscar per Breadly Cooper ,"stato emozionante, americansniper, breadly cooper, cooper, vedere americansniper, prevedo una candidatura all'oscar",1
Just watched the American Sniper It was a damn good movie and what amazed most was that it was based of a true story RIP Chris Kyle,"rip chris kyle, movie, kyle, good movie",0
kendisgibson AmericanSniper the best movie I seen it very realistic about war Bradley Cooper should get a Oscar nod for his performance,"oscar, bradley cooper, war bradley cooper, oscar nod, nod, performance",2
Eastwoods American Sniper Republican Propaganda | FrontPage Magazine ,"frontpage, magazine, eastwoods american sniper republican propaganda",2
american sniper is a classic chris kyle is a beasttttt,classic chris kyle,0
insala AmericanSniper di Clint Eastwood un film su cui riflettere in modo maturo la recensione ,"modo, riflettere, modo maturo, recensione, eastwood un film su cui, maturo",2
AmericanSniper emozioni contrastanti dall'inizio alla fine Bellissimo film e grandissimo (in tutti i sensi Bradley Cooper,"grandissimo, bradley cooper, alla fine bellissimo film e grandissimo, cooper, tutti",2
American Sniper well done Clint,clint,2
Omg watched AmericanSniper last night and all I can say is wow what a film BradleyCooper was outstanding as Chris Kyle,"chris kyle, film bradleycooper, last night, kyle",0
Watched American Sniper last night Absolute 10/10 bradleycooper chriskyle lethal,"chriskyle, watched american sniper, bradleycooper, absolute",2
Class film with Bradley Cooper AmericanSniper,"bradley cooper americansniper, americansniper",1
Grandissimo film AmericanSniper complimenti a Bradley Cooper e a Clint Eastwood WarnerBrosIta ,"warnerbrosita, bradley cooper e, clint eastwood warnerbrosita",2
Everyone should go see American Sniper Chris Kyle is the definition of a true American hero People like him keep this great country afloat,"true american hero people, chris kyle, great country, american, country, people",0
Story of Texan Chris Kyle American Sniper works best as a portrait of PTSD (B+ - Dallas Morning News,"sniper, news, texan chris, b+-dallas morning news, texan chris kyle, ptsd",0
Christmas Box Office Unbroken Into The Woods Score Above Selma American Sniper Score Below,"the woods score, score, american sniper score, christmas box office unbroken, selma american sniper score",2
American Sniper Opens Friday Jan 16 2015Navy SEAL Chris Kyle logs an incredible number of k ,"k, chris kyle, jan, incredible number, seal",0
American Sniper was absolutely phenomenal Bradley Cooper gives a transcending Oscar-worthy performance Eastwood's directing = brilliant,"oscar-worthy performance eastwood, eastwood, bradley cooper, phenomenal bradley cooper",2
I think BenMank77 is 100% accurate with his take on Chris Kyle and the military It's rather obscene to think otherwise AmericanSniper,"chris kyle, 100% accurate",0
American Sniper Opens Friday Jan 16 2015Navy SEAL Chris Kyle logs an incredible number of killsMovie Detai ,"detai, chris kyle, jan, incredible number, seal, killsmovie detai",0
Looking forward to seeing AmericanSniper and Bradley Cooper ,"bradley cooper, americansniper, cooper",2
American Sniper Il nuovo film firmato Clint Eastwood Al Modernissimo ,"al, clint eastwood, eastwood, modernissimo",2
Si ma non posso piangere sempre AmericanSniper bestfilmever navyseal loveit BradleyCooper,"loveit, bradleycooper, americansniper",1
Il dovere morale di Bradley Cooper dovrebbe essere quello di non interpretare alcun film che non sia sequel di Hangover AmericanSniper,"interpretare alcun film che, americansniper, bradley cooper, hangover, il dovere morale, sia sequel",2
AmericanSniper looks MINT bradley cooper is soooo hot,"mint bradley cooper, mint",2
AMERICAN SNIPER di Clint Eastwood | spettacoli ore 1545-1830-2115 ,"spettacoli ore, clint eastwood |, ore",2
AmericanSniper has been watched That shook me and moved me to tears ClintEastwood you've done it again and how,"tears, clinteastwood, 've",2
Lazy Sunday morning in bed watched AmericanSniper quality movie love BradleyCooperSc legend,"lazy sunday morning, legend, bed, bradleycoopersc",2
kelleymplunkett Lazy Sunday morning in bed watched AmericanSniper quality movie love BradleyCooperUS legend,"legend, bradleycooperus, morning, bed",2
Could not have picked a better person than Bradley Cooper in American Sniper ,"sniper, bradley cooper, american, better person",2
AmericanSniper bellissimo film e fantastico Bradley Cooper BradCooper28,"bradcooper28, bradley cooper bradcooper28",2
LanceStuch and with Bradley CooperWet Hot American Sniper,"sniper, bradley cooperwet hot, american",2
davidwain michaelianblack  Even with Bradley Cooper Wet Hot American Sniper,"sniper, bradley cooper, american, davidwain michaelianblack",2
American Sniper Opens Friday Jan 16 2015Navy SEAL Chris Kyle logs an incredible number of killsMovie Deta ,"chris kyle, jan, incredible number, seal, killsmovie deta, deta",0
So fuckin pissed how they're blasting Chris Kyle on the internet since American Sniper came out,"sniper, chris kyle, kyle, american sniper, internet",0
American Sniper la lezione morale di Clint Eastwood | Blog | Sul Romanzo ,"blog, lezione morale, clint eastwood, romanzo",2
Il film American Sniper basato sull'omonimo libro scritto proprio da Chris Kyle e diretto in maniera MAGISTRALE ,"chris kyle e, maniera, magistrale, chris kyle e diretto, diretto",0
American Sniper is a must see film Bradley Cooper career performance blockbuster,"bradley cooper, blockbuster, performance",2
Can't wait to see American Sniper Chris Kyle was a great man who sacrificed so much ,"chris kyle, man, great man",0
loved loved the movie sad sad ending such is life AmericanSniper BradleyCooper SiennaMiller hero war tour Iraq ChrisKyle,"iraq, tour, bradleycooper siennamiller, chriskyle",2
loved loved the movie sad sad ending such is life AmericanSniper BradleyCooper SiennaMiller hero war tour Iraq ChrisKyle Seal,"iraq, chriskyle, bradleycooper siennamiller, seal, chriskyle seal",2
Just finished watching AmericanSniper Great movie Clint Eastwood directed this one perfectly Not one wasted scene 9/10,"eastwood, scene, great movie clint eastwood, americansniper great, clint eastwood",1
American Sniper has only been playing in 4 theaters nationwide since Christmas has already made 3 million dollars impressive,"christmas, 3 million dollars",2
HollywoodChi HCHookup RT Win advance movie tix to AmericanSniper with BradleyCooper from ClintEastwood ,"advance movie tix, bradleycooper, clinteastwood, americansniper",1
Rickyboshe American Sniper ending is heartbreaking Salute to Clint Eastwood MustWatch,"heartbreaking salute, mustwatch, salute to clint eastwood mustwatch",2
Ieri AmericanSniper ha battuto Siani al boxoffice ed ora gli  alle calcagna 108mln contro gli 112 tra poco il sorpasso grandeClint,"grandeclint, alle calcagna, al boxoffice ed ora gli, gli, contro gli",2
Tumben baca buku Di  Reading American Sniper (Enhanced Edition by Chris Kyle Scott Mcewen Jim DeFelice  ,"chris kyle, defelice, american, american sniper, jim defelice, enhanced edition",0
HollywoodChi HCHookup RT Win advance movie tix to AmericanSniper with BradleyCooper from ClintEastwood ,"advance movie tix, bradleycooper, clinteastwood, americansniper",1
MMFlint For someone who hates snipers you sure are painting a big target on your backMMthehollywoodhack Americansniper ChrisKyle,"chriskyle, big target, snipers, target, backmmthehollywoodhack",2
movieweekend Checked out AmericanSniper and amazing job by clinteastwood BradleyCooper MustWatch navyseal ChrisKyle,"chriskyle, bradleycooper mustwatch, americansniper, amazing job",1
Highly recommend AmericanSniper added pride at the end if you're a fellow Texan MarcusLuttrell ChrisKyle AmericanSniper,"the end, pride, americansniper, texan marcusluttrell chriskyle americansniper",1
AmericanSniper goodfilm BradleyCooper ChrisKyle navyseal ,"chriskyle, americansniper goodfilm bradleycooper chriskyle",1
American Sniper was fantastic A near perfect film Cooper's eyes told his story throughout Easily Cooper's best performance ever,"best performance, perfect film cooper, eyes, cooper, story",2
Bawled AmericanSniper silentwalkout ChrisKyle thankyouforyourservice,"chriskyle, thankyouforyourservice",2
Eastwood a lo suyo AMERICAN SNIPER ClintEastwood AmericanSniper ,"clinteastwood, americansniper",1
Just finished watching American Sniper Awesome movie Props to Bradley Cooper for his amazing portrayal AmericanSniper ChrisKyle,"american sniper awesome movie props, amazing portrayal, chriskyle, bradley cooper, cooper",2
AmericanSniper wow what a movie BradleyCooper SiennaMiller are stellar A must see,bradleycooper siennamiller,2
Time to see Bradley Cooper on AmericanSniper movietwit,"bradley cooper, movietwit, americansniper",2
American Sniper was a great movie RIP Chris Kyle,"chris kyle, kyle",0
American Sniper Opens Friday Jan 16 2015Navy SEAL Chris Kyle logs an incredible number of k ,"k, chris kyle, jan, incredible number, seal",0
Veja o novo cartaz e trailer de American Sniper com B Cooper e dirigido por C Eastwood  ,"eastwood, novo cartaz e trailer, b cooper e, por, e, c",2
American Sniper was incredibly powerful I have never been in such a silent theater Bradley Cooper did amazing definitely recommend it,bradley cooper,2
Eastwood a lo suyo AMERICAN SNIPER ClintEastwood AmericanSniper ,"clinteastwood, americansniper",1
Estoy terminando de ver American Sniper Deberia llamarse Bradley Cooper y sus mejillas,"y, bradley cooper y, mejillas, american sniper deberia",2
AmericanSniper best War film ever Good Job clinteastwood,"good job, clinteastwood, best war film",2
Done watching AmericanSniper ChrisKyle is the best long range shooter Shots enemies more than a mile Indeed a 5 star movie satisfied,"mile, americansniper chriskyle, best long range shooter shots enemies, enemies, shots, shooter",1
I hate the damn savages I couldnt give a flying f**k about the Iraqis-American Sniper Chris Kyle,"chris kyle, damn savages, kyle",0
Solo io sono andata a cercare la vita di Chris Kyle dopo aver visto American Sniper,"sniper, american, cercare, chris kyle",0
"Saw AMERICAN SNIPER last night Bradley Cooper was v good solid war movie Suffers from ""biopic hagiography"" syndrome as a film though","biopic hagiography, film, syndrome, good solid war movie, bradley cooper, suffers",2
Bradley Cooper in AmericanSniper ,"bradley cooper, americansniper",2
Bradley Cooper in AmericanSniper  great show ,"bradley cooper, show, americansniper",2
American Sniper Directed by Clint Eastwood First time watch 4/4,"time, watch, clint eastwood first, american sniper directed",2
Just watched AmericanSniper i'm moved beyond words One of the best films i've seen in a long time Absolutely epic BradleyCooperUS,"long time, bradleycooperus, words, 've",2
American Sniper Opens Friday Jan 16 2015Navy SEAL Chris Kyle logs an incredible number of k ,"k, chris kyle, jan, incredible number, seal",0
American sniper was a good movie Really enjoyed Bradley coopers performance,"bradley, coopers, performance, good movie",2
Story of Texan Chris Kyle American Sniper works best as a portrait of PTSD (B+ - Dallas Morning News,"sniper, news, texan chris, b+-dallas morning news, texan chris kyle, ptsd",0
Christmas Box Office Unbroken Into The Woods Score Above Selma American Sniper Score Below,"the woods score, score, american sniper score, christmas box office unbroken, selma american sniper score",2
I cannot fucking wait to see American Sniper badass BradleyCooper,"american, badass, bradleycooper",2
Saw American Sniper Its not half bad if you like war movies and havent read up on Chris Kyle AmericanSniper,"chris, americansniper, war movies, chris kyle americansniper, american sniper, havent",0
Watched American Sniper last night I think Eastwood and Cooper nailed it with this one,"cooper, eastwood",2
American Sniper Opens Friday Jan 16 2015Navy SEAL Chris Kyle logs an incredible number of k ,"k, chris kyle, jan, incredible number, seal",0
AmericanSniper film ben fatto applauso a Bradley Cooper e ad Eastwood per lo stile asciutto e per la messa in scena Tiepidino film,"stile asciutto e, eastwood, bradley cooper e ad eastwood, bradley cooper e, e, americansniper film ben fatto applauso",2
Weird you mean to tell me American Sniper doesnt focus on how Chris Kyle stated he enjoyed killing people believed all Iraqis are savages,"sniper, iraqis, killing people, chris kyle, savages",0
SerenaGuidoni apprezzo il cinema di clinteastwood xch dice chiaramente quello che pensa anche in AmericanSniper nn condivido ma imparo,"anche, quello, americansniper nn, ma, quello che pensa anche, clinteastwood xch dice",1
American Sniper nel film di Clint Eastwood la parabola morale di un cecchino ,"american sniper nel film, morale, cecchino, un, clint eastwood la, clint eastwood la parabola morale",2
Trial of Eddie Routh killer of Chris Kyle will be darkest chapter of American Sniper ,"sniper, chris kyle, darkest chapter, american, eddie routh killer",0
Bradley Cooper rocks AmericanSniper,"bradley cooper, americansniper",2
So fed up with AmericanSniper critics Get a clue See how many Americans see ChrisKyle as a hero STFU criticsyou lost It's final,"chriskyle, americans, hero stfu criticsyou, see, many americans",2
Bradley Cooper on 'American Sniper' 'I wanted to do right by Chris Kyle' | Movi ,"sniper, bradley cooper, chris kyle ', kyle, american sniper ', movi",2
American Sniper wow legend ChrisKyle,chriskyle,2
HollywoodChi HCHookup RT Win advance movie tix to AmericanSniper with BradleyCooper from ClintEastwood ,"advance movie tix, bradleycooper, clinteastwood, americansniper",1
A legacy of a hero lives on this month in cinemas AmericanSniper airborneIMPREZA HonorChrisKyle AmericanSniper,"honorchriskyle, americansniper",1
Worst movies of 2014 American Sniper glosses over Chris Kyles lies ,"sniper, american, chris kyles",0
American Sniper In Theaters Now Starring Bradley Cooper as Chris Kyle Sienna Miller as Taya Renae Kyle Jake ,"jake, chris kyle, american sniper in theaters, chris kyle sienna miller, kyle, kyle jake",0
Powerful Featurettes For Eastwoods AMERICAN SNIPER ,"sniper, eastwoods american sniper",2
Clint Eastwood did a fantastic job with American Sniper Bradley Cooper is incredible,"cooper, american sniper bradley cooper, fantastic job",2
American Sniper Opens Friday Jan 16 2015Navy SEAL Chris Kyle logs an incredible number of k ,"k, chris kyle, jan, incredible number, seal",0
AmericanSniper wow Bradley Cooper <3 x,"bradley cooper, cooper",2
gicvd danicat58 L'ultima fatica di Clint la prima di Stefania Ferraresi cui facciamo gli auguri AmericanSniper  ,"auguri, americansniper, stefania ferraresi, gli, clint, gicvd danicat58 l'ultima fatica",1
You Guys Really want To See A Great Movie Go See AmericanSniper Bradley Cooper is AWESOME In this movie Loved it,"bradley cooper, awesome, americansniper bradley cooper, movie",2
American Sniper was too good and respect Chris Kyle for what he did,"chris kyle, respect chris kyle, kyle",0
Watching American sniper new Bradley Cooper movie decent watch,"watch, bradley cooper, american",2
Chris Pratt could have played Chris Kyle way better AmericanSniper,"chris kyle, chris pratt, americansniper",0
Finally D it took a while for a clintomaniac like me  watching American Sniper,"sniper, american, while, clintomaniac",2
WatchCTVMontreal today 6pm to see my interviews with cast of AmericanSniper Eastwood Cooper ,"americansniper eastwood cooper, cooper, 6 pm",2
AmericanSniper one of my favorite movies Bradley Cooper is just the perfect actor for such a role ,"bradley cooper, perfect actor, actor",2
AmericanSniper ChrisKyle TayaKyle BradleyCooper ClintEastwood Movies ,"clinteastwood, americansniper chriskyle tayakyle, movies",1
American Sniper was great Bradley Cooper did an awesome job with that role,"bradley cooper, awesome job, job, role",2
American Sniper should have just been a montage of Chris Kyle converting goatfuckers trying to set up IEDs into pink mist stillagoodfilmtho,"chris kyle, goatfuckers, mist, ieds, stillagoodfilmtho",0
Nw American Sniper *2014* | 4 The Star Bradley cooper cinema ,"cinema, american, star bradley, american sniper",2
Saw 'American Sniper' last night Awesome movie Bradley Cooper was fantastic AmericanSniper,"last night, bradley cooper, sniper, americansniper",2
"""American Sniper"" was alright but it's no ""Lone Survivor"" but still much respect to the legend ChrisKyle","chriskyle, survivor, much respect, lone survivor",2
FlixChatter Review American Sniper (2014 directed by Clint Eastwood ,"sniper, eastwood, clint eastwood, flixchatter review american sniper",2
Enjoyed AmericanSniper - great acting by BradleyCooper as ChrisKyle and ClintEastwood once again proves he's a superb director,"chriskyle, bradleycooper, clinteastwood, director",2
DruDaVinci When does American Sniper release I thought it came out on Christmas,"christmas, american sniper release, american sniper",2
AmericanSniper BradleyCooper BradleyCooper The more I read watch about this movie the more I want to see it ,"watch, movie, bradleycooper bradleycooper",2
Enjoyed AmericanSniper - great acting by BradleyCooper as the late ex NavySeal ChrisKyle Superb direction by clinteastwood as always,"bradleycooper, late ex navyseal chriskyle superb direction, chriskyle superb, clinteastwood, the late ex, direction",2
In church reading American sniper 160 confirmed kills with 225 claimed kills chris kyle was a beast,"chris kyle, beast, kyle, american sniper",0
American Sniper Opens Friday Jan 16 2015Navy SEAL Chris Kyle logs an incredible number of k ,"k, chris kyle, jan, incredible number, seal",0
cinemaincanavese ifilminprogramma americansniper eastwood quotidianocanavese ,"eastwood, quotidianocanavese",2
And now a hashtag for Bradley Cooper Sienna Miller who are together in AmericanSniper send me your questions on AskRayaBradleySienna ,"questions, askrayabradleysienna, americansniper, sienna miller",1
Pussinabox if there is one film you watch this year it has to be AmericanSniper Bradley Cooper is just amazing fantastic film,"year, americansniper bradley cooper, film",2
American Sniper is the realist movie next to Lone Survivor that I have ever seen Such a great movie ChrisKyle NavySeals TheLegend,"chriskyle navyseals thelegend, thelegend, lone survivor, movie, realist movie",2
"""Che nessun nuovo venga lasciato indietro"" americansniper chriskyle seal film pazzesco ","film, americansniper, pazzesco, chriskyle, indietro",1
AmericanSniper is truly the best movie of the year BradleyCooper You portrayed very well an American hero chriskyle amazed,"the year, year, year bradleycooper, best movie",2
HollywoodChi HCHookup RT Win advance movie tix to AmericanSniper with BradleyCooper from ClintEastwood ,"advance movie tix, bradleycooper, clinteastwood, americansniper",1
Bradley cooper in American sniper ,"sniper, bradley cooper, american",2
'American Sniper' (7/10 tenso biopic que refleja las hazaas de Chris Kyle con buenas dosis de estrs postraumtico ,"con, dosis, chris kyle, de chris kyle, postraumtico, buenas",0
I could've sworn that American Sniper came out on Christmas Day now it come out on the 15th ,"christmas day, day, christmas",2
Which PerformerTrack Member is in AmericanSniper from Clint Eastwood ,"eastwood, clint eastwood, americansniper",1
Which PerformerTrack Member is in AmericanSniper from Clint Eastwood ,"eastwood, clint eastwood, americansniper",1
Which PerformerTrack Member is in AmericanSniper from Clint Eastwood ,"eastwood, clint eastwood, americansniper",1
Which PerformerTrack Member is in AmericanSniper from Clint Eastwood ,"eastwood, clint eastwood, americansniper",1
Chris Kyle over 160 kills  American Sniper,"sniper, chris kyle",0
Two different looks at American Sniper the new Chris Kyle movie starring - Dallas Morning News (blog,"news, morning, chris kyle, blog, american, american sniper",0
