sentences,keywords,cluster_ID_kmeans
Breaking A former Marine has been found guilty of killing AmericanSniper author Chris Kyle and his friend ,"chris kyle, friend, kyle, americansniper",0
Breaking Unanimous - Eddie Ray Routh found guilty of murdering ChrisKyle ChadLittlefield AmericanSniper ,"chriskyle, ray routh, americansniper, chadlittlefield",1
AmericanSniper didn't need to run away w/awards at Oscars The REAL reward is jury finding ChrisKyle Chad Littlefield's murderer guilty,"littlefield, oscars, chriskyle chad littlefield 's, chriskyle chad littlefield, jury, murderer",2
The jury in the AmericanSniper murder trial finds defendant Eddie Routh guilty in killing of ChrisKyle Chad Littlefield,"littlefield, killing, chad, eddie routh, defendant eddie routh, chriskyle chad littlefield",2
May that SOB rot in hell God Bless Chris and Taya Kyle their family as well the Littlefield family AmericanSniper TayaKyle ChrisKyle,"chris, chriskyle, family, kyle, taya kyle, tayakyle",0
Breaking Routh sentenced to life in prison without the possibility of parole AmericanSniper ChrisKyle FoxNews,"foxnews, americansniper chriskyle foxnews, possibility",1
GOD BLESS AMERICA GOD BLESS CHRIS KYLE AmericanSniper ,"chris kyle americansniper, americansniper",1
Guilty Eddie Ray Routh has been found guilty of murdering Navy SEAL ChrisKyle Your reaction snipertrial AmericanSniper,"navy, americansniper, eddie ray routh, guilty eddie ray routh, navy seal chriskyle",1
Ex-Marine found guilty in shooting deaths of AmericanSniper author Chris Kyle another man ,"americansniper author, americansniper, chris kyle, man, deaths",1
Man accused of killing Chris Kyle gets life without parole ,"chris kyle, life, parole",0
Go on brother we got it from here  ChrisKyle AmericanSniper JusticeServed Justice ,"justice, chriskyle americansniper justiceserved justice",1
For the 1st time we are hearing audio from inside the AmericanSniper murder trial ChrisKyle ,"audio, chriskyle",2
Next Hear from Chris Kyle's brother and what he thinks of the verdict AmericanSniper,"chris kyle 's, brother, americansniper",0
HonorChrisKyle AmericanSniperVerdict AmericanSniper heroes HonorChrisKyle ,"honorchriskyle, heroes",2
AirmanKolfage ChrisKyles 19Awards Better Than Any Oscar AmericanSniper ,"chriskyles 19awards better than, americansniper, oscar",1
Clint Eastwood wouldn't apologize to the ADC Muslims for American Sniper Bravo Mister Eastwood ,"adc muslims, eastwood, adc muslims for, adc, clint eastwood",2
"Just finished the book ""American Sniper"" by MrKyle HonorChrisKyle WOW great book Pro military and law enforcement Wish we could of met","mrkyle honorchriskyle wow, enforcement, mrkyle honorchriskyle wow great book pro military, pro, american sniper, law enforcement",2
Beards4Chris AmericanSniper HonorChrisKyle ,honorchriskyle,2
AmericanSniper HonorChrisKyle NavySEALs supportourveterans RedNationRising ,"americansniper honorchriskyle navyseals, supportourveterans",1
Them fake babies in AmericanSniper made me forget this was a Clint Eastwood film ,"eastwood, clint eastwood, film, americansniper",1
After watching American sniper Chris Kyle is a true badass,"chris kyle, badass, american sniper chris kyle",0
Just went and saw American sniper if it doesn't effect you your not American RIP Chris Kyle trueamericanhero theman,"theman, american, chris kyle, american sniper",0
Requiem for an American sniper Godspeed Chris Kyle 02-02-13 RIP Blessed in Memory ,"american, rip, memory, godspeed chris kyle",0
HonorChrisKyle AmericanSniper Hero Navy Hooyah HonorChrisKyle  ,"honorchriskyle, honorchriskyle americansniper hero navy hooyah honorchriskyle",1
Just want to see American Sniper already because Bradley Cooper is bae,"bradley cooper, bae, american, american sniper",2
really wish they had shown when ChrisKyle knocked out Jesse Ventura AmericanSniper ,"jesse ventura americansniper, americansniper, chriskyle",1
What a film American sniper isunbelievable BradleyCooper,bradleycooper,2
Su ilmanifesto oggi Scandaloso Clint una fiamma che non si spegne mai - americansniper clinteastwood ,"che, fiamma che, scandaloso clint, clinteastwood, si, spegne",2
Reading American Sniper so of course I love this paragraph HonorChrisKyle usmc ,"honorchriskyle, usmc, american sniper",2
Decided that I need to see American Sniper because BRADLEY COOPER ,"cooper, american, american sniper",2
Just saw American Sniper great movie avoided being just propaganda- amazing job by Bradley Cooper,"amazing job, bradley cooper, cooper",2
Patriot Guard Riders line the red carpet Bradley Cooper Taya Kyle will walk for premiere of American Sniper ,"sniper, bradley cooper, red carpet bradley cooper taya kyle, kyle, premiere, american sniper",2
Sick to miss American Sniper premiere tonight Had to choose between oldests basketball game and Eastwood/Kyle ChrisLoesch went ahead,"chrisloesch, oldests basketball game, eastwood, kyle chrisloesch, tonight",0
"Where's God in ""American Sniper"" film spulliam details where Chris Kyles' faith is ignored ","american sniper, god, chris kyles ', film spulliam details",0
American Sniper receives Best Picture nomination I hope ChrisKyle biopic wins It's a great story about a great man ,"best picture nomination, chriskyle, hope, story, great story, chriskyle biopic",2
American Sniper earned 6 nominations including Best Picture Best Actor For Bradley Cooper ,"best, bradley cooper, best picture, cooper, best picture best actor",2
Congratulations to Bradley Cooper on his Oscar nomination Our story on how he gained 40 pounds for American Sniper ,"oscar, bradley cooper, oscar nomination, american, story, 40 pounds",2
"  1/2 Steve Carell ""Foxcatcher"" Bradley Cooper American Sniper Benedict Cumberbatch ""The Imitation Game","game, bradley cooper, the imitation game, cumberbatch, benedict cumberbatch, imitation",2
If I did have to pick the best movie of the year I will go with American Sniper because Chris Kyle killed an exceptional amount of people,"exceptional amount, best movie, chris kyle, american, american sniper, people",0
"This is a picture of thelindywest the Guardian ""writer"" who labeled Chris Kyle a hate-filled killer AmericanSniper ","americansniper, chris kyle, guardian, thelindywest, killer",0
Movie review American Sniper's soul is Bradley Cooper writes suhani84 ,"bradley cooper, american sniper 's, soul",2
American Sniper shows just how much our troops sacrifice overseas so that we can enjoy our lives back home ChrisKyle ThankYou,"troops, chriskyle thankyou, thankyou",2
American Sniper was sooooo good Bradley Cooper is amazing,bradley cooper,2
American Sniper was SO FREAKING GOOD Bradley Cooper is a genius,"bradley cooper, good bradley cooper, cooper",2
Ready to see American Sniper Half bc it looks like a great movie and half bc Bradley Cooper starsprobably more so the 2nd reason,"american sniper half bc, half bc bradley cooper, bradley cooper, cooper, half, great movie",2
Oh man just got back from watching American Sniper  This is THE Sniper movie to watch Bradley Cooper puts on ,"sniper, bradley cooper, sniper movie, american sniper",2
Don't take your girl to see American Sniper because she will fall in love with Bradley Cooper and she will leave you,"sniper, bradley cooper, american, american sniper",2
If you have a chance to see American Sniper do it A great movie and even better story Bradley Cooper and Clint Eastwood at their best,"better story bradley cooper, bradley cooper, eastwood, clint eastwood, great movie",2
You've read about Chris Kyle now check out what we thought about American Sniper ,"chris kyle, sniper, american",0
From director Clint Eastwood watch the new trailer for AmericanSniper starring Bradley Cooper and Sienna ,"new trailer, americansniper, bradley cooper, sienna, cooper",2
Saw American Sniper tonight There's a scene where Bradley Cooper is at a bar and Ronaldo Balkman as a Gamecock is on the tv,"bradley cooper, ronaldo balkman, gamecock",2
American Sniper Chris Kyle ,"chris kyle, kyle",0
American sniper was amazingggg Had to be good with Clint Eastwood directing Hit me right in my feelers,"feelers, clint eastwood, amazingggg",2
American Sniper was the best movie I've ever seen No better way to connect to who Chris Kyle was Honestly,"chris kyle, better way, best movie",0
American Sniper is a damn good movie RIPChrisKyle,"ripchriskyle, american sniper",2
Entire premise for the existence of AmericanSniper is built on thousands of lies but let's just fall for Chris Kyle's POV like Clint does,"thousands, pov, chris kyle 's, lies, clint",0
American Sniper definitely lived up to the hype ChrisKyle RestInPeace Hunter,"hunter, chriskyle restinpeace, american sniper",2
Clint Eastwood did about a good a job as you can think of directing American Sniper,"sniper, american, clint eastwood, job",2
American Sniper was a 'life-changing experience' for Oscar nominee Bradley Cooper ,"bradley cooper, life-changing experience, cooper, oscar",2
American Sniper Star Bradley Cooper Just Received Three Huge Stamps of Approval for His Portrayal of Navy SEAL Chris Kyle ,"chris kyle, approval, kyle, portrayal of navy, portrayal, three huge stamps",0
American Sniper Chris Kyle's widow I miss him so much ,"chris kyle 's, widow",0
American Sniper One word WOW RIPChrisKyle,"ripchriskyle, wow",2
American Sniper was a great movie Chris Kyle's life story is out of this world May he rest in peace,"life story, movie, kyle, chris kyle 's, story, great movie chris kyle",0
If you haven't seen American Sniper you need to go see it RIP Chris Kyle,"chris kyle, kyle, american sniper",0
American sniper was such an inspiration too many take for granted what men like chris kyle do for us every day ,"chris kyle, men, kyle",0
The whole theater left in silence after American Sniper Chris Kyle deserves the upmost respect Thank you for serving our country,"chris kyle, american sniper chris kyle, american, respect, country, upmost respect",0
"""nytimes Clint Eastwood narrates a sequence from ""American Sniper"" with Bradley Cooper and Sienna Miller ","bradley cooper, american, sienna miller, american sniper, miller",2
American sniper was absolutely amazing probably one of the best movies I've ever seen  ChrisKyle,chriskyle,2
I spent the evening with Bradley Cooper I will cut another bitch who says she did too AmericanSniper,"bradley cooper, bitch, the evening",2
American Sniper best book I've ever read and best movie I've ever seen RIP Chris Kyle,"chris kyle, american sniper best book, best movie, kyle",0
"CHRISKYLE KILLS IT ""AmericanSniper"" Now Best January Opening For Any Movie Ever ","chriskyle kills it, opening, best january opening, best january, americansniper, movie",1
I have never ever been at the theatre after a movie and there be dead silence Hats off to Chris Kyle AmericanSniper ,"chris, hats, americansniper, chris kyle americansniper, dead silence hats",0
HOOAH Breaking records ChrisKyleFrog HonorChrisKyle Box office report AmericanSniper breaks Jan records ,"jan, records, americansniper, chriskylefrog honorchriskyle box",1
105 millions de pour AmericanSniper de Clint Eastwood Un des meilleurs scores de l'histoire du box-office US ,"clint eastwood un, scores, us, americansniper",1
BadassMiIitary Ultimate respect for Chris Kyle (1974-2013 RIP Solider  AmericanSniper ,"chris kyle, kyle, ultimate respect, badassmiiitary ultimate, solider",0
Really wanna see American Sniper again Chris Kyle is the definition of an American Hero,"an american hero, chris kyle, definition, american, american sniper",0
Bradley Cooper in American Sniper is sexy af,"bradley cooper, american sniper",2
American Sniper Amazing story about an amazing man ChrisKyle ,"chriskyle, american sniper amazing story, american sniper amazing",2
Furthermore the real Chris Kyle is a sadist who openly says that he enjoys killing americansniper,"chris kyle, sadist, americansniper",0
MMFlint You're a despicable clown jealous that AmericanSniper will gross more in 1 weekend than your last 3 movies combined ChrisKyle,"americansniper, chriskyle, despicable clown jealous, 1 weekend, weekend",1
"I want to watch American Sniper then I remember that Clint Eastwood once had a conversation with an empty chair and I'm like ""Naw""","chair, conversation, empty chair, american sniper, clint eastwood",2
Consigli per mirare al film giusto AmericanSniper di ClintEastwood >> ,"clinteastwood, film giusto americansniper, americansniper",1
Big strong badass Bradley Cooper's real training supplement plan for AmericanSniper -- ,"real training supplement plan, americansniper, bradley cooper 's",2
American sniper is the celebration of an American hero A true patriot A true American Thank you Chris Kyle,"chris kyle, american, american thank, true patriot",0
"""ClintEastwoods Fistful Of Dollars AmericanSniper Targets Record Jan 105 Mil 4 Day Bow""~> ","clinteastwoods fistful of dollars americansniper targets record jan, bow""~, mil 4 day bow""~, mil",1
You're 84 and Clint Eastwood What to do Destroy box office records w/ AmericanSniper laugh at Jessie Ventura ,"americansniper, ventura, box office records, jessie ventura, jessie, clint eastwood",1
Hey liberal Hollywood Old White Guys rock the box office Clint is the man AmericanSniper ,"americansniper, old white guys, man, clint, box office",1
AmericanSniper AmericanHERO RIPChrisKyle DevilOfRamadi ,"americansniper americanhero ripchriskyle deviloframadi, deviloframadi",1
American Sniper -    Cooper (B+ movietwit,"cooper, b+, american sniper-    cooper",2
From 'Alias' To 'American Sniper' How Bradley Cooper Become One Of Hollywood's Biggest Stars ,"hollywood, bradley cooper become, stars, biggest stars",2
PaulReverePress Just a reminder that this is Michael Moore's house HonorChrisKyle AmericanSniper tcot ocra ,"honorchriskyle americansniper, michael moore 's, ocra, tcot",1
CHRIS KYLE - MAY YOU RIP - Chris Kyle broke records to save his comrades and so it would appear is American Sniper ,"sniper, rip-chris kyle, records, comrades, american",2
"Me IRL RT PageSix Bradley Cooper ate every 55 minutes to gain weight for ""American Sniper"" ","sniper, pagesix bradley cooper, 55 minutes, american, weight, american sniper",2
Sethrogen And here I thought nobody could top MMFlint for abject stupidity ChrisKyle AmericanSniper,"mmflint, americansniper, chriskyle americansniper",1
Sienna Miller humbled by opportunity to play Taya Kyle in 'American Sniper' | ,"sniper, kyle, american, taya kyle, american sniper",2
I wldn't spend a single dime on a clinteastwood movie no matter who's in it or what it's about edshow AmericanSniper,"single dime, clinteastwood movie, movie, americansniper",1
American Sniper is the best movie of the year ChrisKyle Hero,"chriskyle hero, best movie, hero",2
American Sniper was probably the greatest movie I've ever seen Chris Kyle is a true American Hero,"chris kyle, greatest movie, american hero, american sniper",0
"""3 types of people in this World Sheep Sheepdogs Wolves I'm a sheepdog"" - Chris Kyle American Sniper Great life lesson","chris, life, chris kyle, world sheep sheepdogs wolves, sheepdog, lesson",0
Is there a scene in American Sniper where Clint Eastwood lectures a chair for twenty minutes,"chair, minutes, twenty minutes, american sniper, clint eastwood",2
"For all you ""patriots"" defending Chris Kyle This doesn't sound like a hero to me AmericanSniper ","chris kyle, americansniper, hero",0
Buy TheLegend print of ChrisKyle -AmericanSniper Support his Frog Foundation ,"frog, foundation, chriskyle -americansniper support, thelegend print",2
I've never been so proud to be an American as I am after seeing American Sniper Chris Kyle is truly a legend  God Bless this country,"chris kyle, american, american sniper chris kyle",0
It's sickening that people are criticizing American Sniper Chris Kyle protected your rights so that you are alive to say such things,"things, chris kyle, american sniper chris kyle, american, rights, people",0
The way Bradley Cooper looked in American sniper is how I wanna look he gained close to 40lbs in 10 weeks Naturally that's what I want,"sniper, bradley cooper, american",2
A MUST SEE  OSCAR NOMINATED AmericanSniper IN THEATERS NOW  HonorChrisKyle ChrisKyle Hero ChrisKyleFan ,"americansniper, honorchriskyle, honorchriskyle chriskyle hero chriskylefan, chriskylefan, theaters",1
Bradley Cooper better win an award or 16 for American Sniper,"bradley cooper, award",2
Those people who claim Chris Kyle from American Sniper isn't a hero<<<,"chris kyle, hero, american sniper",0
The fact that people are responding negatively to American Sniper disgracing Chris Kyle by calling him a murderer sickens me,"chris kyle, american, murderer",0
Can't believe the negative comments regarding American Sniper and Chris Kyle I don't understand What ever happened to patriotism,"chris kyle, patriotism, american, american sniper",0
Clint Eastwood American Sniper il film consigliato dal prof Del Zanna per comprendere le Guerre del Golfo iltempoelastoria MaxBernardini,"del, clint eastwood american sniper il film consigliato dal prof del zanna, maxbernardini, zanna, del zanna",2
Yanks Instead of wanting to kill Muslims after watching American Sniper it'd be nice if you hit the gym like Bradley Cooper did fatties,"fatties, bradley cooper, american, muslims, gym, american sniper",2
Interested in being a Volunteer for ChrisKyle Frog Foundation Register here ,"register, chriskyle frog foundation, volunteer",2
Pains me to see people be disrespectful towards Chris Kyle and American Sniper Thats how u repay him Ill help u pack gtfo of America,"ill help, chris kyle, american, american sniper, america, pack gtfo",0
"Michael Moore a Clint Eastwood ""Los francotiradores son cobardes no hroes"" AmericanSniper ","clint eastwood, los, son, hroes",2
Bradley Cooper deserves an Oscar AmericanSniper,"bradley cooper, americansniper, oscar",2
Bradley Cooper Consumed An Insane Amount of Calories To Bulk Up For American Sniper -- ,"an insane amount of calories, calories, bradley cooper consumed, american sniper",2
"I'll never give Clint Eastwood my money again But the more I read about ""American Sniper"" the more disturbed I am ","sniper, clint eastwood, money, american sniper",2
It wasn't the audition that landed Bradley Cooper the role of 'American Sniper' it was the headshots,"sniper, bradley cooper, american, american sniper",2
Riveting unpublished TIME interview with 'American Sniper' Chris Kyle > ,"unpublished time interview, chris kyle, kyle, american, american sniper",0
"""American Sniper"" is like ""The Deer Hunter"" if ""The Deer Hunter"" were directed by a psychotic asshole named Clint Eastwood","eastwood, clint eastwood, clint, "" the deer hunter """,2
American Sniper Screenwriter Blames Clint Eastwood Flaky Babies For That Fake Baby Everyones Complaining About ,"american sniper screenwriter, fake baby everyones, flaky, clint eastwood flaky, babies",2
Someone ask Bradley Cooper why The Hangover had a better baby budget than American Sniper ,"sniper, better baby budget, bradley cooper, hangover, american sniper",2
You've seen AmericanSniper the movie Now read the real story of ChrisKyle ,"chriskyle, real story",2
"FLASHBACK MattKLewis DailyCaller interviews "" American Sniper"" Chris Kyle on his book which is now hit movie ","chris kyle, movie, kyle, american, book, american sniper",0
What a don Chris Kyle must have been Hero AmericanSniper Gripping,"chris kyle, hero americansniper gripping, gripping",0
American Sniper was by far one of the best movies I've ever seen Chris Kyle was a true hero AmericanSniper America,"chris kyle, america, americansniper america, hero",0
Never Go Full Retard emzily1 AmericanSniper NavySEAL ChrisKyle Military USMC ,"chriskyle, usmc, military",2
"AMERICAN SNIPER And then ah was like bang bang pew kablooie Murica THERAPIST Chris the question was ""How are you feeling""","murica therapist chris, bang bang pew kablooie murica therapist chris, question, bang",0
Bradley Cooper reppin' HookEm AmericanSniper ,"bradley cooper, americansniper, bradley cooper reppin",2
Watch AccessHollywood tonight for my intv w/ PiersMorgan re ChrisKyle AmericanSniper Access AmericanSniper ,"chriskyle americansniper access, americansniper, access",1
RaniaKhalek AmericanSniper adctweets Mdogdizzle27 Chris Kyle was a cold blooded terrorist His supporters are just brainwashed morons,"chris kyle, supporters, cold blooded terrorist, morons",0
'American Sniper' Chris Kyle has been slammed by some as deeply flawed They should consider this from George Orwell ,"chris kyle, george orwell, orwell",0
American Sniper's Chris Kyle is a sympathetic warrior The real Chris Kyle was a sociopath who unequivocally viewed his victims as subhuman,"chris kyle, real chris kyle, sympathetic warrior",0
That's why we praise Bradley Cooper's new movie instead of trying to chop it down AmericanSniper Absolutely phenomenal,"new movie, movie, americansniper, bradley cooper 's",2
JokoyaMcLean ChrisKyleFrog OutdoorFoodLove HonorChrisKyle If you go to our website look for the American Sniper line Thank you,"american sniper line, the american sniper, honorchriskyle, website look, jokoyamclean chriskylefrog outdoorfoodlove honorchriskyle",2
American sniper was an incredible movie Bradley Cooper did such a great job,"bradley cooper, incredible movie bradley cooper, job",2
The fascinating life of Chris Kyle the 'American Sniper' ,"chris kyle, american, american sniper",0
Cowardly Pussies CAIR Michael Moore Retreat When Called Out for Attacking AmericanSniper Chris Kyle ,"retreat, americansniper chris kyle, kyle, michael moore retreat",0
I need to get to the theatre soon to see this movie AmericanSniper ChrisKyle AmericanHero ,"chriskyle americanhero, americanhero",2
Baby wasn't the only thing fake in AMERICAN SNIPER Blood guns dialogue emotions Bradley Cooper's accent -- all phony An investigation,"accent, investigation, bradley cooper 's, american sniper blood guns, emotions, american sniper blood",2
If everyone loved this country as much as Chris Kyle did we'd be invincible AmericanSniper,"chris kyle, americansniper, country",0
AMCTheatres watching AmericanSniper about ChrisKyleFrog 'a life ,"life, chriskylefrog, americansniper",1
Blah blah americansniper you were just another bullshit piece of cheesy american propaganda vom bradleycooper still v good,"bradleycooper, bullshit piece",2
He was good friends with AmericanSniper 'Chris Kyle' RealDeanCain opens up to us about the man they called legend Access,"realdeancain, americansniper, access, chris kyle ', good friends",0
American Sniper Bradley Cooper or Dan Bilzerian,"bilzerian, american sniper bradley cooper, dan bilzerian",2
"There's nothing ""Christian"" about AmericanSniper you tcot folk Jesus said ""forgive your enemies"" not snipe them in the head","tcot folk jesus, enemies, jesus, christian",2
CHRIS KYLE MEMORIAL BENEFIT WEEKEND APRIL 30th - May 3rd Guardian4Heroes AmericanSniper HonorChrisKyle ,"guardian4heroes, honorchriskyle, 30th-may 3rd guardian4heroes, 3rd, 30th-may",2
They didn't use a real baby in American Sniper because Bradley Cooper is so method they were worried he would shoot it when it was unarmed,"bradley cooper, method, american, american sniper, real baby",2
WATCH American Sniper Chris Kyle Amazing Interview with Conan a Year Before HeDied ,"chris kyle, conan, year, american sniper chris kyle amazing interview, hedied",0
ChrisKyle AmericanSniper ,chriskyle americansniper,1
'American Sniper' What if both sides are missing Eastwood's point ,"eastwood, point, american sniper",2
On Sheep Wolves and Sheepdogs Sheepdogs LtColGrossman AmericanSniper ChrisKyle ,"chriskyle, sheepdogs, sheepdogs sheepdogs",2
american sniper is basically passion of the christ for republicans,"passion, christ, republicans",2
Ocar Nominated AmericanSniper opening EVERYWHERE Jan 16th based on the true story of America's most deadliest sniper Chris Kyle PJNET,"true story, chris kyle pjnet, everywhere jan 16th, pjnet, america",0
If American Sniper doesn't win best picture and Bradley Cooper doesn't win best actor I'll lose all faith in the film industry,"bradley cooper, best picture, best actor",2
The Real AmericanSniper Why Chris Kyle Wasnt A Hero ,"chris kyle, hero",0
American Sniper Sniped Why Hollywood Lefties Hate Eastwoods Movie ,"eastwoods, movie, american sniper sniped",2
Sad I had no clue who Chris Kyle was until I seen American Sniper What a hero ,"sniper, chris kyle, american, american sniper, hero",0
"Cool photo of Lady Liberty RIP Chris Kyle ""The Legend"" (1974-2013 chriskyle rip thelegend americansniper ","chris kyle, lady liberty, kyle, the legend, legend",0
American Sniper really had me speechless Regardless of your opinion on war/the military this is a movie all should see ChrisKyle,"chriskyle, movie",2
Still not seen american sniper Bradley cooper still dies,"bradley, american sniper bradley cooper",2
Finally saw American Sniperwow respect to everyone serving to protect the best country on earth  and rip Chris Kyle americanhero,"chris kyle, best country, earth, american sniperwow respect, everyone",0
Went to American Sniper Kyle was a patriot among patriots God Bless him those like him who protect our country all that we hold dear,"patriots, god, patriots god, bless, sniper kyle",0
RT BadassMiIitary Ultimate respect for Chris Kyle (1974-2013 RIP Solider AmericanSniper ,"chris, badassmiiitary ultimate respect, chris kyle, kyle, badassmiiitary ultimate",0
Just finished watching American Sniper and Chris Kyle is a hero no matter what y'all say If you say otherwise you're probably a democrat,"chris kyle, hero, american, american sniper",0
American Sniper Complaints Grow in Hollywood Should Clint Eastwood Be Celebrating a Killer ,"killer, clint eastwood, american sniper complaints grow, hollywood",2
American Sniper was as advertised Bradley Cooper did one hell of a job portraying our hero Chris Kyle,"chris kyle, bradley cooper, job, kyle, hell",0
