sentences,keywords,cluster_ID_kmeans
Michael Moore Seth Rogan Hate Film American Sniper Call Chris Kyle a Coward FoxNews hannity SanDiego tcot ,"coward foxnews, film, chris kyle, tcot, american, sandiego",0
Heartfelt post from Chris Kyle's wife ,"chris kyle 's, wife",0
Best part of American Sniper was when they had to go meet Mike Tyson Wait wrong Bradley Cooper movie,"bradley cooper, movie, cooper, american sniper, mike tyson",2
American Sniper was an incredible movie but let's talk about Bradley Cooper with a beard and a gun ,"bradley cooper, beard, cooper, incredible movie, gun",2
Clint Eastwood and Bradley Cooper did an amazing job with American Sniper,"amazing job, sniper, american, bradley cooper",2
American Sniper hands down best movie I've ever seen So thankful for all the men and woman who serve for this country  ChrisKyle,"chriskyle, best movie, american sniper hands",2
The Left's attempt to denigrate Chris Kyle and AmericanSniper is free advertising for the movie LOL tcot tgdn,"americansniper, chris kyle, tgdn, advertising, movie, free advertising",0
American Sniper Breaks Box Office Records As White House Petition For Chris Kyle To Receive Medal of ,"white house petition, chris kyle, medal, american sniper breaks box office, medal of",0
American Sniper is a awesome movie I encourage everyone to go see it RIPChrisKyle,"everyone, awesome movie, ripchriskyle",2
Girl Clint Eastwood can make a movie AmericanSniper,"clint eastwood, americansniper",1
American sniper is one of the best and Chris Kyle is an inspiration ,"chris kyle, inspiration",0
American Sniper is the best movie of the year Cooper definitely deserves an Oscar for this performance,"best movie, oscar, cooper, year cooper, performance",2
American Sniper has me at a loss for words Nothing I say/do could show the amount of appreciation I have for Chris Kyle every soldier,"amount, soldier, chris kyle, appreciation, kyle",0
American Sniper will make you wanna throw a chew in for Chris Kyle,"chris kyle, chris, kyle",0
If you defend American Sniper Chris Kyle you are defending - Terrorism - Racism - Neo-colonialism - Imperialism - Genocide Period,"chris kyle, american sniper chris kyle, period",0
American Sniper Clint Eastwood's best creative effort since he talked to a chair at the RNC,"rnc, effort, best creative effort, clint eastwood 's, chair",2
Saw American Sniper last night Bradley Cooper did an absolutely phenomenal job,"last night, bradley cooper, job",2
I have lost a lot of respect for Seth Rogen after what he has said about Chris Kyle and American Sniper,"sniper, seth rogen, chris kyle, rogen, american",0
The ending of American Sniper when it is Chris Kyle's funeral maybe the saddest thing I've ever seen in a movie,"funeral, movie, chris kyle 's, american sniper, saddest thing",0
If you criticize American Sniper and the life of Chris Kyle then you can gtfo of this country,"chris kyle, kyle, american sniper",0
2 things 1 American sniper is an amazing move and 2 Bradley Cooper may just be about the cutest thing in the world with a southern drawl,"bradley cooper, bradley, amazing move, cutest thing, move",2
CAIR Joins Lib Hate-Fest for American Sniper Calls Chris Kyle Hate-Filled Killer ,"american sniper, chris kyle hate-filled killer, lib hate-fest, killer",0
American Sniper Chris Kyle's Widow Taya 'I Miss Him So Much' ,"miss, chris kyle 's, widow taya, taya, him",0
What a look into the life of Chris and Taya Kyle AmericanSniper ChrisKyleFrog forgedclothing HonorChrisKyle ,"honorchriskyle, chris, taya kyle",0
Just saw American Sniper Wow what a powerful film Not a peep from anyone as we exited the theater Chris Kyle was a true American hero,"chris kyle, theater, american, american sniper, hero",0
Hats off to Clint Eastwood Bradley Cooper Chris Kyle his family the US military  AmericanSniper,"americansniper, chris kyle, us, family, military, clint eastwood bradley cooper chris kyle",0
American Sniper was an amazing movie If you don't feel grateful after watching it you're not AmericanChris Kyle will forever be a legend,"americanchris kyle, amazing movie",0
The people who criticize American Sniper and Chris Kyle dumbfound me,"chris kyle, american, american sniper",0
American Sniper a very powerful movie Bradley Cooper did Chris justice LoveMyCountry,"justice, bradley cooper, chris, lovemycountry",2
AmericanSniper was an AMAZING film Thank you for your hard work and bravery throughout those 4 tours and Rest In Peace Chris Kyle,"chris kyle, hard work, amazing, kyle",0
Pretty twisted when Seth Rogen can bash American Sniper and Chris Kyle but yet he just made a movie about beheading North Koreas leader,"bash, chris kyle, kyle, american, american sniper, north koreas",0
I want a beard like Bradley cooper in American sniper ,"sniper, bradley cooper, american, bradley",2
American Sniper Such an incredible movie  ChrisKyle,"chriskyle, american sniper such, incredible movie",2
Michael Moore Seth Rogan Hate Film American Sniper Call Chris Kyle a Coward redeye tcot racewars RedEyeFNC ,"film, chris kyle, kyle, american, racewars, coward",0
Honestly American Sniper is an awesome movie and Bradly Cooper played that role perfectly,"awesome movie, bradly cooper, role",2
Wife of Chris Kyle 'overwhelmed with gratitude' after success of AmericanSniper ,"success, gratitude, americansniper, chris kyle '",0
Can we have a national Chris Kyle day AmericanSniper AmericanHero,"chris kyle, americanhero",0
byronNME I have to say I agree with you 100% on everything you have said about chris Kyle AmericanSniper He died the same way as he killed,"way, chris kyle americansniper, same way, kyle americansniper",0
"Tweet mensonger l'article ne dit rien ""ELLEfrance AmericanSniper pourquoi le film de Clint Eastwood fait le buzz ","film, eastwood, dit rien, buzz, clint, clint eastwood",2
Time for the premiere of AmericanSniper with noopwanii Reviewer face on for BradleyCooper  ,"noopwanii reviewer face, bradleycooper, americansniper, reviewer",1
Anybody who says anything bad about AmericanSniper ChrisKyle Can literally go fuck themselves Seriously ,"chriskyle, americansniper chriskyle, fuck",1
"""American sniper like Brad Cooper killed my communist grandfather Coop is a coward"" -- Michael More ","brad cooper, michael more, coop, michael, communist grandfather coop, coward",2
IrisD236 absolutely deserving for all noms B Cooper and I didn't recognize Siena Miller Wow AmericanSniper ,"siena miller, americansniper, b cooper",1
"""There was a competition between myself some other snipers 2 see who got the most kills"" AmericanSniper Chris Kyle ","americansniper chris kyle, most kills, kyle",0
American sniper breaking box office records Clint Eastwood's the man brandoeaton is The boy ,"man, man brandoeaton, american sniper breaking box office records clint eastwood, brandoeaton, boy, clint eastwood",2
Il cinema nel week end all'Odeon c' Clint Eastwood e il suo potente American Sniper al ,"clint eastwood e, nel week end, il, suo, c, il cinema nel week end",2
Feel compelled to tweet about AmericanSniper Silence post-movie as crowd dispersed was almost as moving as movie Thank you ChrisKyleFrog,"americansniper silence, chriskylefrog, movie, americansniper silence post-movie, crowd",1
Tutti al cinema a vedere American Sniper il filmone sparatutto di Clint Eastwood che ha deluso il Corriere ,"american sniper, deluso, clint eastwood che, filmone sparatutto, corriere, clint eastwood",2
Loved every second of AmericanSniper both times Bradley Cooper is amazing in this movie Powerhouse actor without a doubt,"actor, bradley cooper, movie, doubt, movie powerhouse actor, powerhouse",2
American sniper probably is one of the top movies ever created Rip ChrisKyleAmericanHero,"chriskyleamericanhero, rip chriskyleamericanhero",2
If you think American Sniper is at all about the number of kills Chris Kyle had in his career you're extremely dense,"chris kyle, sniper, career",0
SCHLICHTER Detonate the Narrative Hollywoods Self-Loathing Cant Overshadow American Sniper Chris Kyle ,"chris kyle, kyle, the narrative hollywoods self-loathing ca, overshadow american",0
"'American Sniper' sets January record NEW YORK  Clint Eastwood's R-rated Iraq War drama ""A ","iraq war, drama, iraq war drama, clint eastwood 's, record new york",2
Almost forgot how perfect Bradley cooper is  AmericanSniper,"perfect bradley cooper, americansniper, bradley",2
ChristiChat MMFlint Sethrogen Tactical Hooyah ThankfulTuesday Salute to ChrisKyle AmericanSniper ,"americansniper, salute, chriskyle, christichat mmflint sethrogen tactical, christichat mmflint sethrogen tactical hooyah thankfultuesday salute",1
Green Beret Sniper hilariously slams cupcake Michael Moore forcalling AmericanSniper Chris Kyle a coward ,"chris, chris kyle, kyle, americansniper chris kyle, coward, michael moore",0
AmericanSniper Michael Moore Offers Non-Apology Apology After Chris Kyle Snipe As many of us have likely he ,"americansniper michael moore offers non-apology apology, kyle, snipe, chris kyle snipe",0
you want a politically balanced American Sniper you get Ben Affleck to make lah Hang tatau Clint Eastwood tuh fascist prick,"ben affleck, hang, american sniper, prick, clint eastwood",2
7 big lies American Sniper is telling America about Iraq and Chris Kyle - fyilive - ,"iraq, chris kyle-fyilive, chris kyle-fyilive -, america, kyle-fyilive",0
"TRENDING (HonorChrisKyle Feb 2nd In memory of ""The Legend"" Chris Kyle (All day AmericanSniper PJNET","all day, memory, chris kyle, honorchriskyle feb 2nd, honorchriskyle feb, pjnet",0
From 'Alias' To 'American Sniper' How Bradley Cooper Became One Of Hollywood's Biggest Stars ,"bradley cooper, hollywood, stars, biggest stars",2
How Is Bradley Cooper Getting Away with Pretending That 'American Sniper' Is Apolitical | Alternet ,"alternet, getting, pretending, american sniper, bradley cooper getting",2
At the conclusion of 'American Sniper' you could have heard a pin drop It was as if people were saluting Chris Kyle with their silence,"silence, chris kyle, kyle, pin drop, american sniper",0
My biggest problem with American Sniper is that Chris Kyle is supposed to be the best sniper ever but didn't pull of ONE 360 no scope Smh,"sniper, best sniper, chris kyle",0
"I'd like to see Clint Eastwood have a one on one ""Talk"" with Michael Moore about his comments on American Sniper","sniper, michael moore, american, comments, clint eastwood, one",2
Aww Rip Chris Kyle frogman American Sniper touched my heart ChrisKyle TheLegendfrogmanAmericanSniper,"sniper, chriskyle, heart, thelegendfrogmanamericansniper, american, aww rip chris kyle",0
BWGotheem Ultimate respect for Chris Kyle  (1974-2013 RIP Solider  AmericanSniper ,"chris kyle, bwgotheem ultimate, kyle, ultimate respect, solider",0
notredamelax30 7News AmericanSniper BradleyCooperUS BradleyCooperPA great to hear We can show our support through our 's,"support, americansniper bradleycooperus",1
You've seen AmericanSniper the movie Now read the real story of ChrisKyle ,"chriskyle, real story",2
"I would read American Sniper the book before watching movie ""by Chris Kyle"" ","chris kyle, chris, movie, kyle",0
"Si Michael Moore y Seth Rogen critican ""American Sniper"" y es dirigida por Clint Eastwood hay 3 razones suficientes para verla","verla, seth rogen, moore y, american sniper, clint eastwood, y es dirigida por clint eastwood hay",2
RTChrisKyleFan RIP to a true hero please honor his memory RIPChrisKyle AmericanSniper HonorChrisKyle ,"honorchriskyle, ripchriskyle, true hero",2
It is noteworthy that AmericanSniper has driven the left into paroxyms of hate ClintEastwood must have hit some kind of nerve again,"left, nerve, clinteastwood, kind, paroxyms",2
"If you have a problem with American Sniper or think Chris Kyle was a ""murderer"" then you're an idiot and can gtfo out of this country ASAP","idiot, chris kyle, asap, american, american sniper, murderer",0
Regardless of how you feel about ChrisKyle American Sniper is Hollywood brainwashing its best Increase islamaphobiawar is good mentality,"hollywood, chriskyle american sniper, increase, mentality",2
Send strong messages Go see AmericanSniper or Fury instead of the SOTU TONIGHT tcot ocra HonorChrisKyle,"honorchriskyle, fury, strong messages, americansniper",1
American Sniper was really good the ending tore me up But Bradley Cooper did an amazing job,"bradley cooper, job, american sniper",2
Meet the real AmericanSniper Cameron_Gray ICYMI In 2012 I was fortunate enough to interview ChrisKyle - ,"chriskyle, americansniper, real americansniper cameron_gray icymi, icymi",1
RealJamesWoods Scarlett210 INSTANT CLASSIC HonorChrisKyle ChrisKyleFrog AmericanSniper Montel_Williams,"chriskylefrog, montel_williams, americansniper",1
At NHLJets practice and thinking Harrison looks like Chris Kyle in American Sniper Excellent movie check it out,"american sniper excellent movie check, check, chris kyle, harrison, american sniper excellent",0
So glad American Sniper was made otherwise half of America would have never new who Chris Kyle was Glad we could recognize his legacy,"chris kyle, america, glad, half",0
The system that created Chris Kyle is the same system that killed him AmericanSniper,"chris kyle, same system, system",0
"Saw ""American Sniper"" this weekend Amazing story beautiful film Eastwood deserves an Oscar Go see it","oscar go, eastwood, weekend amazing story, american sniper, beautiful film eastwood, go",2
American Sniper completely covers up/ignores the fact that Chris Kyle was a big fat liar,"chris kyle, liar, fat",0
Y'all should go see AmericanSniper tonightTo hell with the SOTUGo honor son of TX Chris Kyle not community-organizing sumbitch Obama,"chris kyle, sotugo, obama, sotugo honor son, americansniper tonightto hell, tx chris kyle",0
American Sniper was Clint Eastwoods second-greatest work of fiction,"fiction, work, clint eastwoods",2
American Sniper Chris Kyle was a lying liar and Jesse Ventura proved it By mjs_DC GovJVentura ,"govjventura, mjs_dc, chris kyle, jesse ventura",0
AmericanSniper Chris Kyle ,"chris kyle, kyle",0
Agree with Sethrogen It's incredible that Tarantino made American Sniper before Eastwood did ,"eastwood, tarantino, american sniper",2
its bullshit they whitewashed Lee Boyd Malvo by casting bradley cooper as him in American Sniper,"bradley cooper, lee boyd malvo, cooper, bradley",2
American Sniper Chris Kyle and Liberal Loathing ,"chris kyle, loathing",0
This song was written to SupportOurTroops and to honor the life of ChrisKyle AmericanSniper Veterans america ,"america, life, chriskyle americansniper veterans",1
Definitely tryna read Chris Kyle's autobiography after watching American Sniper,"sniper, american, chris kyle 's, autobiography",0
"Question ""How do you make such great moviesI gots to know"" ClintEastwood AmericanSniper Hollywood Malpaso ","malpaso, clinteastwood americansniper hollywood malpaso, such great moviesi gots",1
American Sniper is what happens when you let Clint Eastwood take over the American Pie franchise,"the american pie, clint eastwood, american sniper",2
American Sniper was such a good movie Bradley Cooper did a really good job playing Chris Kyle If you haven't seen it yet GO SEE IT ASAP,"good job, good movie bradley cooper, chris kyle, bradley cooper, kyle",2
Moving video about widow of Chris Kyle (americansniper hunting in Wyoming ,"chris kyle, wyoming, americansniper hunting",0
The fascinating life of Chris Kyle the 'American Sniper' ,"chris kyle, american, american sniper",0
To all the naysayers snarking on Cooper's performance in AMERICAN SNIPER I give you THIS MASTERPIECE ,"cooper, masterpiece, american sniper",2
LOVED AmericanSniper Forget the haters get yourself (double quick to a cinema near you let Cooper Eastwood entertain your Ass ,"cinema, double quick, cooper eastwood, ass, haters",2
American Sniper was just  Bradley Cooper Sienna Miller were fab,"bradley cooper, sienna miller",2
Well Kyle lied RT dankois Jesse Ventura was awarded 18mil from estate of American Sniper Chris Kyle for what ,"chris kyle, american sniper chris kyle, kyle, american, estate, jesse ventura",0
Peek into the making of AmericanSniper --> Chris Kyles widow struggled with having husband portrayed on film ,"film, americansniper, chris kyles, husband, widow",0
Clint Eastwood American Sniper il film consigliato dal prof Del Zanna per comprendere le Guerre del Golfo iltempoelastoria MaxBernardini,"del, clint eastwood american sniper il film consigliato dal prof del zanna, maxbernardini, zanna, del zanna",2
American Sniper How army sharpshooter Chris Kyle's story has become a political battleground ,"chris kyle 's, story, battleground",0
The fascinating life of Chris Kyle the 'American Sniper' ,"chris kyle, american, american sniper",0
I can't believe people are criticizing Chris Kyle and American Sniper norespect,"chris kyle, sniper, american, norespect",0
People who are hating on American Sniper piss me off Chris Kyle is an American hero and so is everyone who fights for this great country,"chris kyle, american, chris, american hero",0
I just feel the need to say that American sniper was an amazing film and ChrisKyle is an hero,"chriskyle, hero, amazing film, american sniper",2
"What ""American Sniper"" the movie won't tell you about Chris Kyle This is the real American Sniper ","chris kyle, american, american sniper",0
Read TIME's 2013 interview with 'American Sniper' Chris Kyle ,"chris kyle, american, kyle, american sniper",0
"Fake plastic baby in American Sniper = wars of aggression over oil products Can we give ol' ""empty chair"" Eastwood that much credit","credit, eastwood, empty chair, american sniper, oil products",2
The real American Sniper Chris Kyle being interviewed on Conan ,"chris kyle, conan",0
_ArmandoJaleo yo acabo de ver American Snipery nono es una peli de solo de guerra buena historia real firmada por Clint Eastwood,"eastwood, peli, american, american snipery nono es una peli, clint eastwood",2
Actually Clint Eastwood is very anti-war (whatever you thought of 'American Sniper' ,"war, american, clint eastwood, american sniper",2
I saw the commercial for the movie American Sniper and now I know everything there is to know about Chris Kyle and will defend his honor,"chris kyle, movie, honor, american, american sniper",0
This Chris Kyle movie looks AWESOME AmericanSniper NationsPride ,"chris kyle, nationspride, americansniper",0
Move over Bradley Cooper CT's dauber246 is also in AmericanSniper See how he's using his sudden fame next on WFSBnews at 6,"dauber246, americansniper, sudden fame, bradley cooper ct 's, wfsbnews, fame",2
Just saw American Sniper - speechless ChrisKyleAmericanHero AmericanSniper,"chriskyleamericanhero, american, americansniper",1
After seeing American Sniper I had to get this wedge to rep Chris Kyle legend ,"chris kyle, legend, wedge, american sniper",0
'American Sniper' or 'Selma' How Christian is your movie choice ,"choice, christian, american sniper",2
DID THEY LOSE BUDGETING FOR AMERICAN SNIPER OR COULD THEY NOT TRUST BRADLEY COOPER WITH A REAL BABY ,"baby, with, cooper, american sniper or could, could, trust",2
My thoughts on AmericanSniper - its Clint more or less making that Nations Pride film from Inglourious Basterds Revisionist jingoism,"revisionist, nations pride, jingoism, clint, pride film, inglourious basterds",2
Ocar Nominated AmericanSniper opening EVERYWHERE Jan 16th based on the true story of America's most deadliest sniper Chris Kyle PJNET,"true story, chris kyle pjnet, everywhere jan 16th, pjnet, america",0
ORDER YOUR CHRIS KYLE GEAR BOOKS AT ,"chris kyle, books, at",0
"TRENDING (HonorChrisKyle Feb 2nd In memory of ""The Legend"" Chris Kyle (All day AmericanSniper PJNET","all day, memory, chris kyle, honorchriskyle feb 2nd, honorchriskyle feb, pjnet",0
WE THANK YOU CHRIS KYLE    AmericanHero AmericanSniper HonorChrisKyle ,"honorchriskyle, americanhero americansniper honorchriskyle, chris kyle",0
American sniper lived upto expectations  Chris kyle is top boi ,"boi, chris, upto expectations",0
Romans 134 AmericanSniper ChrisKyle ,chriskyle,2
If you have seen AmericanSniper turn to oreillyfactor on FoxNews he is re-airing his interview with Chris Kyle worth a watch,"chris kyle, watch, interview, foxnews, kyle, americansniper turn",0
washingtonpost I'd love to see a double feature of American Sniper and Sgt York - both featuring great actors named Cooper,"cooper, american, american sniper, sgt york-both, double feature",2
Imagine going to the cinema to watch American Sniper and it would just be a 2 hour long cut-comm of Bradley Cooper trickshotting in FFA,"sniper, bradley cooper, american, american sniper, ffa",2
American Sniper is a great film and Chris Kyle is an American hero fuck that ignorant bitch,"great film, chris kyle, american hero fuck, bitch, american sniper",0
American sniper is too good Chris Kyle is defiantly a hero in my books,chris kyle,0
The most powerful thing about American Sniper was when the movie ended the whole theatre was silent Chris Kyle was the man,"whole theatre, chris kyle, movie, man, kyle",0
Inside 'AmericanSniper' How Clint Eastwood Cast A Real Navy Seal ,"seal, clint eastwood, navy",2
American Sniper was such a great movie Chris Kyle is a true American hero hard to believe people can go to that movie and disrespect him,"american sniper, american hero, chris kyle, movie chris kyle",0
Nothing redeemable about ChrisKyle or AmericanSniper His own family was terrified of him He would have killed them but was taken out,"chriskyle, family, americansniper",1
"I'm starting a petition to recall""American Sniper"" until they hire an actual baby to play Chris Kyle's baby fav/retweet to sign","baby, retweet, actual baby, chris kyle 's, baby fav, recall""american sniper",0
Fact of the Day Patriots AmericanSniper ChrisKyle Veterans military ObamaFailYetAgain NeverForget ,"neverforget, day patriots, chriskyle veterans, obamafailyetagain",2
American sniper is by far my favorite movie I've ever seen or will see Chris Kyle was a true hero,"chris kyle, hero",0
In honor of the American Sniper we thank you for your service to our country  Rest in Peace Chris Kyle ,"chris, the american sniper, kyle",0
In honor of the American Sniper we thank you for your service to our country  Rest in Peace Chris Kyle ,"chris, the american sniper, kyle",0
American Sniper Clint Eastwood never disappoints,clint eastwood,2
American Sniper was a great movie  rest in peace Chris Kyle,"chris kyle, kyle, great movie, rest",0
Standing O for Clint Eastwood on AmericanSniper A beautiful and well-deserved tribute,"tribute, americansniper a, clint eastwood, americansniper a beautiful",1
If you want to properly memorialize Chris Kyle wipe your dog's ass with pages from his memoir daily AmericanSniper,"americansniper, memoir, chris kyle, ass, dog, pages",0
In honor of the American Sniper we thank you for your service to our country  Rest in Peace Chris Kyle ,"chris, the american sniper, kyle",0
American Sniper was an awesome movie and Chris Kyle is an American HERO and should be treated and talked about as such,"chris kyle, awesome movie, american hero, american sniper",0
"""LifeAsSoldier Chris Kyle was a Legend  ","legend, lifeassoldier chris kyle",0
CauseWereTexas Retweet if you support Chris Kyle AmericanSniper ,"causeweretexas retweet, chris kyle americansniper, americansniper",1
People need to shut up about American Sniper Chris Kyle is a hero Let the flag of freedom fly over the heads of those who doubt him ,"heads, chris kyle, flag, freedom, american",0
Cackling at the fake baby in American Sniper Way to cut that budget Clint ,"american sniper way, american, clint",2
American sniper by far the greatest movie I've ever seen R I P Chris Kyle and thank you for your service,"chris kyle, r, kyle, p chris kyle",0
s/o Bradley Cooper for AmericanSniper that's Georgetown right there ,"bradley cooper, georgetown, americansniper",2
Dont underestimate PTSD This movie has me deep in my feelings I salute you Chris Kyle A true American Hero AmericanSniper,"american hero americansniper, americansniper, chris kyle a",1
AmericanSniper HonorChrisKyle ChrisKyleFrog Wore my shirt to the movie RIP Chris Chad ,"chad, chris chad, movie, shirt, americansniper honorchriskyle chriskylefrog wore",1
AmericanSniper was one hell of a movie Thank you BradleyCooperUS and ChrisKyleFrog for bringing this to life,"life, chriskylefrog, bradleycooperus, movie",2
I just found a movie to put on the top of my list AmericanSniper forChrisKyle,"list, top, forchriskyle",2
AmericanSniper spent so much money getting Bradley Cooper that they couldn't afford a real baby for the movie ThatsADoll,"thatsadoll, much money, bradley cooper, cooper, real baby",2
mikandynothem THANK YOU CLINT EASTWOODGIVE US MORE AMERICAN SNIPER MOVIEYOU ARE THE BEST FORGET THE REST OF HOLLYWOOD PERVERTS,"sniper, us, clint eastwoodgive, movieyou, forget the rest of, perverts",2
Confused on why people are hating on Chris Kyle/American sniper If he didn't do his duty our people would have died so would our freedom,"american sniper, sniper, chris kyle, people",0
American sniper was lethal like Chris Kyle you legend,"chris kyle, kyle",0
Can't sleep after seeing American Sniper Chris Kyle is a legend Hooyah,"chris kyle, legend, hooyah",0
American Sniper author Chris Kyle responsible for over 160 kills shot dead in Texas ,"chris kyle, american sniper author, texas",0
"Ex-Navy SEAL flaming racist/Islamophobe Chris Kyle also author of ""American Sniper"" shot killed at a gun range ","chris kyle, range, american sniper, shot, gun, islamophobe chris kyle",0
swin24 thedailybeast AmericanSniper Thank you Bradley Cooperwell said,"swin24 thedailybeast americansniper, bradley cooperwell",1
The real man behind 'American Sniper' Chris Kyle's story ,"chris kyle 's, american, story, american sniper",0
